en_term_processed;en_definition_processed;ru_term_processed;ru_definition_processed
rayleigh quotient;scalar valu deriv squar matrix nonzero vector defin ra x x x x x matrix x vector eigenvalu problem estim eigenvalu;отношен рэле;скалярн величин вычисля квадратн матриц ненулев вектор ra x x a x x x a матриц x вектор использ задач собствен значен оценк
rayleigh scatter;elast scatter light electromagnet radiat particl smaller wavelength radiat result preferenti scatter shorter wavelength blue light respons blue color sky;рэлеевск рассеян;упруг рассеян свет друг электромагнитн излучен частиц значительн меньш длин волн излучен приводя преимуществен рассеян коротк волн син свет объясня голуб цвет неб
rayleighjean;classic physic law describ blackbodi radiat intens long wavelength fail short wavelength ultraviolet catastroph;рэлеяджинс;классическ закон физик описыва интенсивн излучен абсолютн черн тел больш длин волн дающ сбо мал ультрафиолетов катастроф
rayleighritz variat principl;mathemat method quantum mechan structur mechan approxim lowest eigenvalu system minim rayleigh quotient repres ratio potenti kinet energi system;вариацион принцип рэлеяритц;математическ метод квантов структурн механик приближен нахожден наименьш собствен значен систем пут минимизац отношен рэле представля соотношен потенциальн кинетическ энерг систем
reactant concentr;reactant present given volum solut typic express mole liter m influenc rate chemic reaction accord law mass action;концентрац реагент;количеств реагент зада объем раствор выража мол литр m влия скорост химическ реакц согласн закон действ масс
reaction;process substanc interact form new product involv bond break format energi chang;реакц;процесс веществ взаимодейств образу нов продукт разрыв образован связ изменен энерг
reaction coordin;onedimension path repres progress chemic reaction reactant product potenti energi diagram illustr energi chang reaction;координат реакц;одномерн пут представля прогресс химическ реакц реагент продукт используем диаграмм потенциальн энерг иллюстрац изменен энерг ход реакц
reaction coordin;paramet set paramet describ progress chemic reaction pathway reactant product plot potenti energi surfac;реакцион координат;параметр набор параметр описыва ход химическ реакц пут реагент продукт используем построен потенциальн энергетическ поверхн
reaction energi diagram;graphic represent energi chang occur chemic reaction show rel energi reactant transit state intermedi product illustr activ energi overal reaction energi chang;диаграмм энерг реакц;графическ представлен изменен энерг ход химическ реакц показыва относительн энерг реагент переходн состоян промежуточн продукт конечн веществ энерг активац общ изменен энерг реакц
reaction entropi;chang entropi chemic reaction calcul differ entropi product reactant constant temperatur pressur;энтроп реакц;изменен энтроп ход химическ реакц рассчитыва разниц энтроп продукт реагент постоя температур давлен
reaction gibb energi;chang gibb free energi chemic reaction constant temperatur pressur indic reaction spontan;энерг гиббс реакц;изменен свободн энерг гиббс химическ реакц постоя температур давлен указыва спонтан реакц
reaction intermedi;transient chemic speci form reaction react yield final product unstabl highli reactiv play key role reaction mechan catalysi;промежуточн продукт реакц;неустойчив высокореакцион промежуточн химическ продукт образ ход реакц участв дальн превращен конечн продукт игр ключев рол механизм реакц катализ
reaction kinet;branch chemistri studi rate chemic reaction factor affect includ concentr temperatur catalyst provid insight reaction mechan help optim industri process;кинетик реакц;раздел хим изуча скорост химическ реакц фактор влия концентрац температур катализатор позволя поня механизм реакц оптимизирова промышлен процесс
reaction mechan;stepbystep sequenc elementari reaction overal chemic chang occur includ intermedi transit state breakingform chemic bond;механизм реакц;пошагов последовательн элементарн реакц ход происход химическ превращен промежуточн соединен переходн состоян разрывобразован химическ связ
reaction pathway;sequenc elementari step chemic reaction proce reactant product includ intermedi transit state determin reaction mechan kinet;реакцион пут;последовательн элементарн стад химическ реакц протека реагент продукт промежуточн соединен переходн состоян определя механизм кинетик реакц
reaction probabl;likelihood collis reactant molecul result chemic reaction express ratio reactiv collis total collis;вероятн реакц;вероятн столкновен молекул реагент приведет химическ реакц выража отношен реактивн столкновен общ числ столкновен
reaction product imag;techniqu visual spatial distribut product form chemic reaction studi reaction dynam;визуализац продукт реакц;метод визуализац пространствен распределен продукт химическ реакц применя изучен динамик
reaction profil;graphic represent energi chang chemic reaction show reactant transit state intermedi product;профил реакц;графическ представлен изменен энерг ход химическ реакц показыва реагент переходн состоян промежуточн соединен продукт
reaction quotient;measur rel amount product reactant present reaction particular point time calcul formula equilibrium constant nonequilibrium concentr;коэффициент реакц;величин характеризующ соотношен количеств продукт реагент реакц определен момент времен рассчитыва формул констант равновес неравновесн концентрац
reaction rate constant;paramet rate equat quantifi speed chemic reaction typic depend temperatur describ arrheniu equat relat reaction rate concentr reactant;констант скорост реакц;параметр уравнен скорост определя скорост химическ реакц завися температур описыва уравнен аррениус связыва скорост реакц концентрац реагент
reaction rate determin;process measur speed chemic reaction proce typic monitor chang concentr reactant product time control condit understand reaction kinet;определен скорост реакц;процесс измерен скорост протекан химическ реакц пут наблюден изменен концентрац реагент продукт времен контролируем услов изучен кинетик реакц
reaction rate enhanc;increas speed chemic reaction factor like catalyst temperatur pressur lower activ energi increas molecular collis;ускорен скорост реакц;увеличен скорост химическ реакц действ фактор катализатор температур давлен снижа энерг активац увеличива числ молекулярн столкновен
reaction spontan;thermodynam properti indic reaction occur extern energi input determin gibb free energi chang δg δg neg reaction spontan;спонтан реакц;термодинамическ свойств указыва реакц протека внешн энергетическ воздейств определя изменен энерг гиббс δг δг отрицательн реакц спонтан
reaction ion;chemic process posit neg charg ion interact form new compound precipit;реакц ион;химическ процесс взаимодейств положительн отрицательн заряжен ион образ нов соединен осадк
reactiv potenti energi surfac;multidimension represent potenti energi chemic system function atom coordin studi reaction dynam transit state molecular collis chemic reaction;реакцион поверхн потенциальн энерг;многомерн представлен потенциальн энерг химическ систем функц атомн координат используем изучен динамик реакц переходн состоян молекулярн столкновен химическ реакц
real ga;ga behav ideal ga intermolecular forc particl volum especi high pressur low temperatur;реальн газ;газ ведет идеальн изз межмолекулярн сил объем частиц высок давлен низк температур
real gase;gase behav ideal gase interact molecul finit molecular volum especi high pressur low temperatur describ equat state like van der waal equat;реальн газ;газ ведут идеальн изз межмолекулярн взаимодейств конечн объем молекул высок давлен низк температур описыва уравнен состоян уравнен вандерваальс
real number;valu repres quantiti continu line includ integ fraction irrat number;веществен числ;значен представля величин непрерывн числов прям цел числ дроб иррациональн числ
real solut;solut interact solut solvent particl deviat ideal affect properti like vapor pressur boil point;реальн раствор;раствор взаимодейств частиц растворен веществ растворител отклоня идеальн вли свойств давлен пар точк кипен
rearrang;chemic reaction structur molecul rearrang form new isom differ compound molecular formula;перегруппировк;химическ реакц структур молекул изменя образован нов изомер друг соединен молекулярн формул
reconstruct;process rebuild reassembl structur mechan system origin improv state;реконструкц;процесс восстановлен пересборк структур механизм систем исходн улучшен состоян
redlichkwong equat;empir thermodynam equat state describ behavior real gase improv ideal ga law account molecular size intermolecular forc given p rtvm b a√t vmvm b p pressur vm molar volum t temperatur b substancespecif constant;уравнен редлихаквонг;эмпирическ термодинамическ уравнен состоян описыва поведен реальн газ учитыва размер молекул межмолекулярн сил вид p rtvm b а√т vmvm b p давлен vm молярн обь t температур a b констант веществ
redox coupl;pair chemic speci involv oxidationreduct reaction speci oxid reduc;редокспар;пар химическ веществ участв окислительновосстановительн реакц веществ окисля восстанавлива
redox reaction;chemic reaction involv transfer electron speci lead chang oxid state consist halfreact oxid loss electron reduct gain electron;окислительновосстановительн реакц;химическ реакц включа перенос электрон частиц привод изменен степен окислен состо двух полуреакц окислен потер электрон восстановлен приобретен электрон
reduc mass;measur effect inerti mass twobodi system calcul μ m₁ m₂ m₁ m₂ m₁ m₂ mass interact bodi simplifi analysi rel motion;приведен масс;эффективн инерцион масс систем двух тел вычисля μ м₁ м₂ м₁ м₂ м₁ м₂ масс взаимодейств тел упроща анализ относительн движен
reduc planck constant;fundament physic constant equal planck constant divid 2π denot ħ hbar quantum mechan simplifi equat involv angular momentum wave function;приведен постоя планк;фундаментальн физическ констант равн постоя планк делен 2π обознача ħ hбар использ квантов механик упрощен уравнен связа момент импульс волнов функц
reduc variabl;dimensionless quantiti deriv scale thermodynam variabl eg pressur temperatur volum critic valu describ univers behavior equat state;приведен перемен;безразмерн величин получен масштабирован термодинамическ перемен давлен температур объем критическ значен используем описан универсальн поведен уравнен состоян
reduc agent;substanc donat electron chemic speci redox reaction oxid;восстановител;веществ отда электрон друг химическ веществ окислительновосстановительн реакц окисл
reduct;chemic reaction involv gain electron decreas oxid state molecul atom ion;восстановлен;химическ реакц связа приобретен электрон уменьшен степен окислен молекул атом ион
refer electrod;electrod stabl wellknown potenti refer point electrochem measur determin potenti electrod system;эталон электрод;электрод стабильн известн потенциал используем электрохимическ измерен качеств точк отсчет определен потенциа электрод
refer state;standard thermodynam state baselin calcul properti materi defin condit eg pressur temperatur;референтн состоян;стандартн термодинамическ состоян используем качеств базис расчет свойств материал определен услов давлен температур
refin;process improv precis accuraci model measur experiment setup iter adjust correct;уточнен;процесс повышен точност аккуратн модел измерен экспериментальн установк пут итеративн корректировок исправлен
reflect;chang direct wavefront interfac differ media caus return medium origin;отражен;изменен направлен волнов фронт границ раздел двух различн сред вызыва возвращен сред возник
reflect symmetri;properti object system remain unchang reflect specif plane known mirror symmetri;зеркальн симметр;свойств объект систем оста неизмен отражен относительн определен плоскост известн симметр отражен
refract;bend light pass medium differ optic densiti govern snell law;рефракц;преломлен свет переход сред друг разн оптическ плотност описыва закон снеллиус
refract index;dimensionless number describ light propag medium defin ratio speed light vacuum speed medium;показател преломлен;безразмерн величин описыва распространен свет сред определя отношен скорост свет вакуум скорост сред
refriger cycl;thermodynam process transfer heat lowtemperatur region hightemperatur region typic involv compress condens expans evapor refriger achiev cool;холодильн цикл;термодинамическ процесс перенося тепл област низк температур област высок включа сжат конденсац расширен испарен хладагент охлажден
refriger;devic compart use heat pump transfer heat insid outsid cool content;холодильник;устройств отсек использ теплов насос перенос тепл изнутр наруж охлажд содержим
regular solut;solut enthalpi mix nonzero entropi mix ideal mean interact unlik molecul differ like molecul;регулярн раствор;раствор энтальп смешен отличн нул энтроп смешен идеальн означа различ взаимодейств разнородн молекул сравнен однородн
relat;connect associ variabl entiti phenomena describ mathemat conceptu scientif context;связ;связ ассоциац двум перемен объект явлен описыва математическ концептуальн научн контекст
relat partial molar free energi;connect thermodynam quantiti partial molar free energi repres chang free energi mole compon mixtur compon vari keep temperatur pressur compon constant;связ парциальн молярн свободн энерг;связ термодинамическ величин парциальн молярн свободн энерг представля изменен свободн энерг мол компонент смес изменен количеств постоя температур давлен компонент
relat rate constant;mathemat empir connect reaction rate constant paramet like temperatur concentr catalyst presenc;связ констант скорост;математическ эмпирическ связ констант скорост реакц параметр температур концентрац налич катализатор
rel humid;measur curr moistur air vs max possibl temp express;относительн влажност;отношен текущ влажност воздух максимальн возможн температур выражен
rel molecular mass;ratio mass molecul 112th mass carbon12 atom dimensionless compar molecular weight;относительн молекулярн масс;отношен масс молекул 112 масс атом углерода12 безразмерн величин используем сравнен молекулярн масс
rel permitt;dimensionless measur materi abil store electr energi electr field compar vacuum;относительн диэлектрическ проницаем;безразмерн величин характеризующ способн материа накаплива электрическ энерг электрическ пол сравнен вакуум
rel popul;ratio number particl specif quantum state total number particl system statist mechan;относительн заселен;отношен числ частиц определен квантов состоян общ числ частиц систем использ статистическ механик
rel pressur;ratio absolut pressur ga satur vapor pressur ga given temperatur adsorpt studi describ pressur condit rel gass satur point;относительн давлен;отношен абсолютн давлен газ давлен насыщен пар температур используем исследован адсорбц описан услов давлен относительн точк насыщен
relativist;pertain involv theori rel especi describ phenomena veloc approach speed light;релятивистск;относя теор относительн описыва явлен скорост близк скорост свет
relax;process system return equilibrium disturb involv energi dissip character relax time quantifi rate return equilibrium;релаксац;процесс возвращен систем равновес возмущен сопровожда диссипац энерг характериз времен релаксац определя скорост возвращен
relax mechan;process system return equilibrium disturb involv energi dissip redistribut;механизм релаксац;процесс систем возвраща равновес возмущен включа диссипац перераспределен энерг
relax time;characterist time requir system return equilibrium disturb context molecular spin relax physic chemistri nmr spectroscopi;врем релаксац;характерн врем необходим систем возврат равновес возмущен использ контекст молекулярн спинов релаксац физическ хим ямрспектроскоп
rempi;resonanceenhanc multiphoton ioniz rempi laserbas techniqu select ioniz molecul reson absorpt multipl photon enabl sensit detect statespecif analysi;ремп;резонансноусилен многофотон ионизац ремп лазерн метод селективн ионизац молекул резонансн поглощен нескольк фотон обеспечива чувствительн детектирован анализ конкретн состоян
reorgan energi;energi requir adjust molecular geometri solvent configur electron transfer process crucial marcu theori;энерг реорганизац;энерг необходим изменен молекулярн геометр конфигурац растворител процесс перенос электрон ключев теор маркус
replica exchang;simul techniqu molecular dynam multipl copi replica system run differ temperatur condit period swap configur enhanc sampl energi landscap improv converg;обм реплик;метод молекулярн динамик коп систем реплик моделир разн температур услов периодическ обменив конфигурац улучшен сэмплирован энергетическ ландшафт сходим
represent;way describ depict system phenomenon mathemat symbol model simplifi analysi understand;представлен;способ описан изображен систем явлен использован математическ символическ модел упрощен анализ пониман
repres;sampl portion accur reflect properti composit larger statist experiment analysi;репрезентативн;образец част отража свойств соста больш цел статистическ экспериментальн анализ
repuls interact;type interact particl molecul forc caus apart oppos tendenc come closer;отталкива взаимодейств;тип взаимодейств частиц молекул сил заставля удаля друг друг препятству сближен
repuls interact;forc particl molecul caus apart typic overlap electron cloud electrostat repuls like charg prevent occupi space;отталкива взаимодейств;сил частиц молекул заставля отталкива изз перекрыт электрон облак электростатическ отталкиван одноимен заряд препятству сближен
repuls surfac;surfac intermolecular forc gener repuls prevent adhes close contact molecul particl;отталкива поверхн;поверхн межмолекулярн сил созда отталкиван препятству адгез тесн контакт молекул частиц
