en_term_processed;en_definition_processed;ru_term_processed;ru_definition_processed
electrochemistri;branch chemistri studi relationship electr energi chemic chang includ reaction involv electron transfer redox convers chemic energi electr energi vice versa batteri fuel cell electrolysi;электрохим;раздел хим изуча взаимосвяз электрическ энерг химическ изменен реакц перенос электрон окислительновосстановительн преобразован химическ энерг электрическ батаре топливн элемент электролиз
electrod;conductor electr enter leav object substanc region electrochem cell facilit redox reaction;электрод;проводник электричеств вход выход объект веществ област используем электрохимическ ячейк облегчен окислительновосстановительн реакц
electrod compart;separ section electrochem cell contain electrod electrolyt isol prevent mix reactant product;электродн отсек;отдельн секц электрохимическ ячейк содержа электрод электрол изолирова предотвращен смешиван реагент продукт
electrod concentr cell;galvan cell voltag gener differ concentr electrolyt electrod;концентрацион элемент электрод;гальваническ элемент напряжен возника изз разниц концентрац электролит двух электрод
electrod passiv;process electrod reactiv format passiv layer typic oxid compound inhibit electrochem reaction phenomenon common batteri corros studi;пассивац электрод;процесс снижен реакцион способн электрод изз образован пассивн сло оксид подавля дальн электрохимическ реакц встреча батаре исследован корроз
electrod potenti;voltag develop electrod equilibrium ion solut measur rel standard hydrogen electrod quantifi tendenc chemic speci gain lose electron;электродн потенциа;напряжен развива электрод равновес ион раствор измерен относительн стандартн водородн электрод свэ характериз склонност химическ вид приобретен потер электрон
electrod potenti calcul;process determin potenti differ electrod refer electrod standard condit nernst equat account concentr temperatur factor influenc redox reaction;расчет электродн потенциа;процесс определен разност потенциал электрод стандартн электрод сравнен использован уравнен нернст учет концентрац температур фактор влия окислительновосстановительн реакц
electrodialysi;separ process ion transport ionexchang membran influenc electr field desalin purif solut;электродиализ;процесс разделен ион перемеща ионообмен мембра действ электрическ пол используем опреснен очистк раствор
electrokinet potenti;potenti differ stationari layer fluid attach charg surfac bulk fluid aris rel motion appli electr field;электрокинетическ потенциа;разност потенциал неподвижн сло жидкост прикреплен заряжен поверхн объемн жидкост возника относительн движен действ приложен электрическ пол
electrolysi;process use electr current drive nonspontan chemic reaction decompos compound constitu element simpler compound;электролиз;процесс использ электрическ ток проведен несамопроизвольн химическ реакц разлага соединен составн элемент прост соединен
electrolyt;substanc produc electr conduct solut dissolv polar solvent water dissoci substanc ion electrolyt essenti biolog chemic process includ nerv conduct batteri oper;электрол;веществ образ электропроводя раствор растворен полярн растворител вод изз диссоциац ион электролит важн биологическ химическ процесс проведен нервн импульс работ батар
electrolyt concentr cell;galvan cell gener electr energi differ electrolyt concentr halfcel typic involv electrod materi;концентрацион элемент электролит;гальваническ элемент вырабатыва электрическ энерг счет разниц концентрац электролит двух полуэлемент использован одинаков материа электрод
electrolyt cell;devic use electr energi drive nonspontan chemic reaction typic involv decomposit compound element simpler compound electrolysi consist electrod anod cathod immers electrolyt solut;электролитическ ячейк;устройств использ электрическ энерг проведен несамопроизвольн химическ реакц разложен соединен элемент прост веществ электролиз состо двух электрод анод катод погружен раствор электролит
electromagnet radiat;form energi emit absorb charg particl exhibit wavelik behavior propag space encompass spectrum radio wave gamma ray;электромагнитн излучен;форм энерг излуча поглоща заряжен частиц проявля волнов свойств распространен пространств охватыва спектр радиоволн гаммалуч
electromagnet spectrum;rang type electromagnet radiat gamma ray radio wave character wavelength frequenc photon energi;электромагнитн спектр;диапазон тип электромагнитн излучен гаммалуч радиоволн характериз длин волн частот энерг фотон
electromot forc;electr potenti differ gener sourc batteri gener drive current circuit;электродвижущ сил;разност электрическ потенциал создава источник батаре генератор вызыва ток цеп
electron;subatom particl neg electr charg found atom act primari carrier electr solid;электрон;субатомн частиц отрицательн электрическ заряд присутствующ атом явля основн носител электричеств тверд тел
electron affin;energi chang electron ad neutral atom form neg ion reflect atom abil attract electron;электрон сродств;изменен энерг добавлен электрон нейтральн ат образован отрицательн ион отража способн атом притягива электрон
electron cloud;region surround atom nucleu electron like found visual fuzzi area uncertainti posit describ quantum mechan;электрон облак;област атомн ядр электрон вероятн наход визуализир размыт зон изз неопределен положен согласн квантов механик
electron cloud model;quantum mechan model describ electron exist probabl cloud nucleu fix orbit base schrödinger equat electron densiti distribut;модел электрон облак;квантовомеханическ модел описыва электрон существ вероятностн облак ядр фиксирова орбит основа уравнен шредингер распределен электрон плотност
electron configur;distribut electron atom molecul atom molecular orbit follow pauli exclus principl hund rule;электрон конфигурац;распределен электрон атом молекул атомн молекулярн орбитал подчиня принцип запрет паул правил хунд
electron densiti;measur probabl electron present specif locat space repres function ρr quantum chemistri solidst physic;электрон плотност;мер вероятн нахожден электрон определен точк пространств представля функц ρр квантов хим физик тверд тел
electron diffract;phenomenon electron scatter crystallin materi produc diffract pattern reveal atom structur wide materi scienc crystallographi studi arrang atom solid;электрон дифракц;явлен рассеян электрон кристаллическ материал созда дифракцион картин раскрыва атомн структур широк применя материаловеден кристаллограф изучен расположен атом тверд тел
electron domain;region central atom molecul electron like found includ bond pair lone pair predict molecular geometri;электрон дом;област центральн атом молекул вероятн нахожден электрон связыва несвязыва пар используем предсказан геометр молекул
electron magnet field;electron subject magnet field experienc lorentz forc alter motion energi level studi quantum mechan condens matter physic;электрон магнитн пол;электрон находя воздейств магнитн пол испытыва сил лоренц изменя движен энергетическ уровн изуча квантов механик физик конденсирова состоян
electron orbit;region atom nucleu electron like found describ quantum mechan wave function defin electron energi angular momentum spatial distribut;электрон орбита;област ядр атом электрон вероятн описыва квантов механик волнов функц определя энерг момент импульс пространствен распределен электрон
electron pair;electron occupi orbit opposit spin form coval bond lone pair molecul;электрон пар;два электрон занима орбитал противоположн спин образ ковалентн связ неподелен пар молекул
electron paramagnet;properti materi contain unpair electron exhibit magnet expos extern magnet field studi electron paramagnet reson epr;электрон парамагнитн;свойств материал неспарен электрон проявля магнетизм действ внешн магнитн пол исследуем метод электрон парамагнитн резонанс эпр
electron spin;intrins properti electron give magnet moment angular momentum quantiz ±½ unit ħ reduc planck constant;спин электрон;внутрен свойств электрон прида магнитн момент момент импульс квантуем ±½ единиц ħ постоя планк
electron spin reson;spectroscop techniqu detect unpair electron magnet field measur absorpt microwav radiat studi paramagnet materi;электрон парамагнитн резонанс;спектроскопическ метод обнаружива неспарен электрон магнитн пол пут измерен поглощен микроволнов излучен применя изучен парамагнитн материал
electron transfer;process electron electron donor electron acceptor fundament redox reaction charg transport energi convers;перенос электрон;процесс перемещен электрон донор электрон акцептор электрон ключев окислительновосстановительн реакц перенос заряд преобразован энерг
electron tunnel;quantum phenomenon electron pass potenti barrier classic nt overcom waveparticl dualiti;туннелирован электрон;квантов феном электрон проход потенциальн барьер классическ преодолева дуализм волнычастиц
electron volt;unit energi equal kinet energi gain singl electron acceler electr potenti differ volt vacuum commonli physic chemistri express small energi valu energi particl photon;электронвольт;единиц энерг равн кинетическ энерг приобрета электрон ускорен вакуум действ разност потенциал вольт широк использ физик хим выражен мал значен энерг
electroneg;chemic properti describ tendenc atom attract share pair electron coval bond dimensionless quantiti measur paul scale crucial understand bond polar reactiv;электроотрицательн;химическ свойств атом описыва способн притягива пар электрон ковалентн связ безразмерн величин измеря шкал полинг важн пониман полярн связ реакцион способн
electron;relat involv electron flow electr charg devic circuit system;электрон;относя электрон связа поток электрическ заряд устройств цеп систем
electron molecular;relat behavior structur properti electron molecul studi quantum chemistri spectroscopi;электрон молекулярн;относя поведен структур свойств электрон молекул изуча квантов хим спектроскоп
electron energi transfer;process energi transfer molecul atom electron excit occur photochemistri molecular spectroscopi;перенос электрон энерг;процесс передач энерг молекул атом друг электрон возбужден встреча фотохим молекулярн спектроскоп
electron mean energi;averag energi electron system calcul quantum chemistri describ electron state distribut;средн электрон энерг;средн энерг электрон систем рассчитыва квантов хим описан электрон состоян распределен
electron partit function;statist mechan term repres sum electron energi state molecul weight boltzmann factor crucial calcul thermodynam properti;электрон статистическ сумм;термин статистическ механик представля сумм электрон энергетическ состоян молекул взвешен больцмановск множител важн расчет термодинамическ свойств
electron polariz;measur easili electron cloud atom molecul distort extern electr field influenc materi dielectr properti;электрон поляризуем;мер наскольк легк электрон облак атом молекул искаж внешн электрическ пол вли диэлектрическ свойств материа
electron spectra;spectra result electron transit energi level atom molecul typic observ uvvi spectroscopi;электрон спектр;спектр возника электрон переход энергетическ уровн атом молекул наблюда уфвидим спектроскоп
electron wave function;mathemat function describ quantum state electron system provid inform electron posit energi properti solut schrödinger equat fundament quantum mechan predict electron behavior atom molecul;электрон волнов функц;математическ функц описыва квантов состоян электрон систем содержа информац положен энерг свойств явля решен уравнен шредингер использ квантов механик предсказан поведен электрон атом молекул
electronvolt;unit energi equal work electron move electr potenti differ volt approxim 1602×10⁻¹ joul;электронвольт;единиц энерг равн работ соверша перемещен электрон электрическ пол разност потенциал вольт примерн 1602×10⁻¹ джоул
electrostat forc;forc charg particl object describ coulomb law state forc directli proport product charg invers proport squar distanc;электростатическ сил;сил заряжен частиц объект описыва закон кулон глас сил прям пропорциональн произведен заряд обратн пропорциональн квадрат расстоян
electrostat interact;forc charg particl molecul govern coulomb law state like charg repel opposit charg attract interact fundament chemistri influenc molecular structur stabil reactiv;электростатическ взаимодейств;сил заряжен частиц молекул описыва закон кулон одноимен заряд отталкива разноимен притягива взаимодейств важн хим вли структур стабильн реакцион способн молекул
electrostat potenti surfac;3d represent electrostat potenti molecul show region posit neg charg predict reactiv interact;поверхн электростатическ потенциа;трехмерн представлен электростатическ потенциа молекул показыва област положительн отрицательн заряд используем предсказан реакцион способн взаимодейств
electrostat;studi stationari electr charg forc exert govern coulomb law;электростатик;раздел физик изуча взаимодейств неподвижн электрическ заряд сил действ описыва закон кулон
elementari reaction;singlestep chemic reaction reactant directli form product intermedi step follow law mass action;элементарн реакц;одностадийн химическ реакц реагент непосредствен превраща продукт промежуточн стад подчин закон действ масс
elementari step;singl reaction step chemic mechan involv reactant form product intermedi simplest process contribut overal reaction;элементарн стад;одиночн этап химическ реакц реагент превраща продукт образован промежуточн соединен прост процесс внося вклад реакц
eleyrid mechan;surfac reaction mechan gasphas molecul react directli adsorb speci catalyst surfac requir adsorpt reactant;механизм элиридиа;механизм поверхностн реакц молекул газов фаз непосредствен реагир адсорбирова веществ поверхн катализатор адсорбц обо реагент
emf;energi unit charg convert revers chemic mechan form energi electr energi devic batteri gener;эдс;энерг единиц заряд обратим преобраз химическ механическ форм энерг электрическ энерг устройств батаре генератор
emiss spectra;rang wavelength electromagnet radiat emit atom molecul transit higher lower energi state identifi element compound spectroscopi;спектр излучен;диапазон длин волн электромагнитн излучен испуска атом молекул переход высок низк энергетическ уровен используем идентификац элемент соединен спектроскоп
emiss spectroscopi;techniqu analyz light emit atom molecul return lower energi state excit identifi element concentr;эмиссион спектроскоп;метод анализ свет излуча атом молекул возвращен низш энергетическ состоян возбужден используем идентификац элемент концентрац
emiss spectrum;spectrum frequenc electromagnet radiat emit atom molecul transit higher lower energi state identifi substanc;спектр излучен;спектр частот электромагнитн излучен испуска атом молекул переход высок низк энергетическ состоян используем идентификац веществ
emmett p;scientist known contribut surfac chemistri catalysi particularli bet theori measur surfac area materi;эмметт;учен известн работ област поверхностн хим катализ теор бэт измерен площад поверхн материал
emulsifi agent;substanc stabil emuls reduc interfaci tension immisc liquid prevent separ;эмульгир агент;веществ стабилизир эмульс уменьш межфазн натяжен несмешива жидкост предотвра расслоен
encount pair;transient pair molecul form collis solut react separ reaction;встречн пар;времен пар молекул образующ столкновен раствор вступ реакц разойт
endenthalp process;process occur constant enthalpi heat exchang surround seen adiabat system;энтальпийн процесс;процесс происходя постоя энтальп обм тепл окружа сред наблюда адиабатическ систем
endergon reaction;chemic reaction requir energi input proceed result product higher free energi reactant commonli occur biolog system;эндергоническ реакц;химическ реакц требующ подвод энерг протекан приводя образован продукт высок свободн энерг исходн веществ встреча биологическ систем
endotherm;process reaction absorb energi surround typic form heat result decreas temperatur surround character posit chang enthalpi δh 0;эндотермическ;процесс реакц поглоща энерг окружа сред вид тепл привод снижен температур окружен характериз положительн изменен энтальп δh 0
endotherm process;process absorb heat surround result posit chang enthalpi δh 0;эндотермическ процесс;процесс поглоща тепл окружа сред привод положительн изменен энтальп δh 0
endotherm reaction;chemic reaction absorb heat surround result decreas temperatur system energi requir reaction taken environ make surround cooler;эндотермическ реакц;химическ реакц поглоща тепл окружа сред привод понижен температур систем энерг реакц забира окружен охлажд
energi;capac work transfer object convert differ form kinet potenti thermal chemic energi fundament concept physic chemistri govern law thermodynam;энерг;способн соверша работ передава объект преобразовыва различн форм кинетическ потенциальн теплов химическ энерг фундаментальн понят физик хим регулируем закон термодинамик
energi barrier;minimum energi requir chemic reaction occur repres differ energi reactant transit state determin reaction rate key concept chemic kinet thermodynam;энергетическ барьер;минимальн энерг необходим протекан химическ реакц представля разниц энерг реагент переходн состоян определя скорост реакц явля ключев понят химическ кинетик термодинамик
energi densiti;energi store given system region space unit volum mass compar differ energi storag method fuel;энергетическ плотност;количеств энерг запасен систем област пространств единиц объем масс использ сравнен различн метод хранен энерг топлив
energi densiti state;number electron state unit energi interv given energi level materi crucial understand electron properti;плотност состоян энерг;количеств электрон состоян единичн интерва энерг зада уровн энерг материал важн пониман электрон свойств
