en_term_processed;en_definition_processed;ru_term_processed;ru_definition_processed
ligandtomet transit;electron transfer ligand metal center coordin complex lead charg transfer band uvvi spectra;лигандметалльн переход;перенос электрон лиганд металлическ центр координацион комплекс приводя появлен полос перенос заряд уфвидим спектроскоп
ligas;class enzym catalyz join molecul form new chemic bond energi atp hydrolysi play crucial role dna replic repair biosynthet process;лигаз;класс фермент катализир соединен двух молекул образован нов химическ связ использу энерг гидролиз атф игра ключев рол репликац репарац днк биосинтетическ процесс
light scatter;physic phenomenon light deflect diffus direct interact particl irregular medium studi particl size molecular weight structur materi scienc chemistri;рассеян свет;физическ явлен свет отклоня рассеива различн направлен изз взаимодейств частиц неоднородн сред используем изучен размер частиц молекулярн масс структур материаловеден хим
limit;term describ reactant chemic reaction entir consum limit product form;ограничива;термин описыва реагент химическ реакц полност расход перв сам ограничив количеств образ продукт
limit law;theoret law describ behavior solut infinit dilut solutesolut interact neglig;предельн закон;теоретическ закон описыва поведен раствор бесконечн разбавлен взаимодейств частиц растворен веществ станов пренебрежим мал
limit molar conduct;molar conduct electrolyt solut infinit dilut ionion interact neglig;предельн молярн проводим;молярн проводим раствор электролит бесконечн разбавлен взаимодейств ион пренебрежим мал
linc;comput method system biolog predict gene express chang respons chemic genet perturb integr data sourc includ gene express profil molecular interact;lincs;вычислительн метод системн биолог предсказыва изменен экспресс ген ответ химическ генетическ воздейств интегриру различн источник проф экспресс ген молекулярн взаимодейств
lind refriger;devic use joulethomson effect liquefi gase isenthalp expans commonli employ cryogen air separ ga liquefact;холодильник линд;устройств использ эффект джоулятомсон сжижен газ пут изэнтальпийн расширен применя криогеник разделен воздух сжижен газ
lindemann f;frederick lindemann physicist known contribut thermodynam spectroscopi notabl lindemann mechan explain unimolecular reaction;линдема;фредерик линдема физик известн вклад термодинамик спектроскоп механизм линдема объясня мономолекулярн реакц
lindemann mechan;theori explain unimolecular reaction molecul gain energi collis decompos isomer;механизм линдема;теор объясня мономолекулярн реакц молекул получа энерг столкновен разложен изомеризац
lindemannhinshelwood;mechan chemic kinet describ unimolecular reaction intermedi energ molecul form collis;механизм линдеманнахиншелвуд;механизм химическ кинетик описыва мономолекулярн реакц промежуточн возбужден молекул образова столкновен
line broaden;increas width spectral line mechan doppler effect pressur natur lifetim;уширен лин;увеличен ширин спектральн лин вызва различн механизм эффект доплер давлен естествен врем жизн
line space;vertic distanc line text document measur baselin baselin affect readabl layout adjust singl doubl custom space depend requir;межстрочн интерва;вертикальн расстоян строк текст документ измеря базов лин базов лин влия удобочитаем макет одинарн двойн зада вручн
linear combin;mathemat express construct multipli element set constant ad result vector space linear algebra describ span vector;линейн комбинац;математическ выражен получен умножен кажд элемент множеств констант сложен результат используем векторн пространств линейн алгебр описан линейн оболочк вектор
linear combin atom orbit;quantum chemistri method molecular orbit form combin atom orbit describ electron behavior molecul;линейн комбинац атомн орбитал;метод квантов хим молекулярн орбита образ пут комбинац атомн орбитал используем описан поведен электрон молекул
linear freeenergi relat;relationship reaction rate equilibria substitu effect express linear equat eg hammett brønsted equat;линейн соотношен свободн энерг;зависим скорост реакц равновес эффект заместител выража линейн уравнен уравнен гаммет бренстед
linear hydrocarbon;hydrocarbon straightchain molecular structur consist sole carbon hydrogen atom bond continu unbranch sequenc;линейн углеводород;углеводород прямолинейн молекулярн структур состоя исключительн атом углерод водород соединен непрерывн неразветвлен цеп
linear independ;set vector vector space linearli independ vector set express linear combin mean solut equat c₁v₁ c₂v₂ cₙvₙ 0 c₁ c₂ cₙ 0;линейн независим;набор вектор векторн пространств линейн независ ни вектор выраж линейн комбинац остальн единствен решен уравнен c₁в₁ c₂в₂ cₙвₙ 0 c₁ c₂ cₙ 0
linear interpol;method estim valu known data point assum linear relationship mathemat engin approxim intermedi valu;линейн интерполяц;метод оценк значен двум известн точк предполага линейн зависим используем математик инженер приближен промежуточн значен
linear momentum;vector quantiti equal product object mass veloc describ motion;линейн импульс;векторн величин равн произведен масс тел скорост описыва движен
linear momentum gradient;spatial rate chang linear momentum fluid dynam quantum mechan describ momentum variat;градиент линейн импульс;пространствен скорост изменен линейн импульс используем гидродинамик квантов механик описан вариац импульс
linear momentum oper;quantum mechan oper repres linear momentum particl given iħ∇ posit space;оператор линейн импульс;квантовомеханическ оператор представля линейн импульс частиц задава иħ∇ координатн пространств
linear oper;mathemat oper satisfi properti addit homogen mean preserv vector addit scalar multipl fundament linear algebra function analysi;линейн оператор;математическ оператор удовлетворя свойств аддитивн однородн сохраня сложен вектор умножен скаляр основополага линейн алгебр функциональн анализ
linear plot firstord;graphic represent natur logarithm reactant concentr versu time firstord reaction yield straight line slope equal neg rate constant;линейн график реакц перв порядк;графическ представлен натуральн логарифм концентрац реагент времен реакц перв порядк дающ прям лин наклон равн отрицательн величин констант скорост
linear plot;graph relationship variabl repres straight line simplifi data analysi model linear relationship scientif experi;линейн график;график связ перемен представл прям лин используем упрощен анализ моделирован линейн зависим научн эксперимент
linear rotor;molecul system rotat singl axi exhibit linear symmetri quantiz rotat energi level commonli studi rotat spectroscopi;линейн ротор;молекул систем враща ос облада линейн симметр квантова уровн вращательн энерг изуча вращательн спектроскоп
linear superposit;principl state linear system net respons caus stimuli sum respons caus stimulu individu principl fundament physic engin mathemat particularli wave theori quantum mechan;линейн суперпозиц;принцип согласн линейн систем общ отклик воздейств рав сумм отклик воздейств отдельн основополага принцип физик инженер математик теор волн квантов механик
linear system;system output directli proport input obey superposit principl describ linear differenti equat;линейн систем;систем выход прям пропорционал вход подчиня принцип суперпозиц описыва линейн дифференциальн уравнен
linear;process approxim nonlinear system function linear mathemat engin simplifi analysi solut complex problem;линеаризац;процесс аппроксимац нелинейн систем функц линейн используем математик инженер упрощен анализ решен сложн задач
linearsweep voltammetri;electrochem techniqu potenti vari linearli time measur current respons studi redox process;линейноразвернут вольтамперометр;электрохимическ метод потенциа изменя линейн времен измерен ток применя изучен редокспроцесс
lineshap;function form spectral line describ intens distribut function frequenc wavelength influenc broaden mechan like doppler pressur effect;форм лин;функциональн форм спектральн лин описыва распределен интенсивн зависим частот длин волн влия механизм уширен доплеровск давлен
lineweaverburk equat;linear form michaelismenten equat enzym kinet express 1v kmvmax1 1vmax v reaction rate s substrat concentr km micha constant vmax maximum reaction rate;уравнен лайнуивераберк;линеаризова форм уравнен михаэлисамент используем кинетик фермент 1v kmvmax1s 1vmax v скорост реакц s концентрац субстрат km констант михаэлис vmax максимальн скорост
lineweaverburk plot;doubl reciproc plot enzymat reaction kinet plot 1v vs 1s determin vmax km michaelismenten equat;график лайнуивераберк;двойн обратн зависим кинетик ферментативн реакц отобража 1v 1s используем определен vmax km уравнен михаэлисамент
linu paul;american chemist biochemist peac activist signific contribut understand chemic bond molecular structur award nobel prize chemistri 1954 nobel peac prize 1962;лайнус поллинг;американск химик биохимик пацифист внесш значительн вклад пониман химическ связ молекулярн структур лауреат нобелевск прем хим 1954 нобелевск прем мир 1962
lipid bilay;thin polar membran layer lipid molecul form basic structur cell membran provid barrier structur function;липидн бисл;тонк полярн мембра состоя двух сло липидн молекул формирующ основн структур клеточн мембра выполня барьерн структурн функц
liposom;spheric vesicl compos phospholipid bilay deliv drug genet materi cell;липосом;сферическ везикул состоя нескольк фосфолипидн бисло используем доставк лекарств генетическ материа клетк
liposom encapsul;process liposom spheric vesicl lipid bilay encapsul drug activ substanc improv deliveri stabil bioavail;липосомальн инкапсуляц;процесс липосом сферическ везикул липидн бисло использ инкапсуляц лекарств активн веществ цел улучшен доставк стабильн биодоступн
liquefact;process convert ga solid liquid state typic cool appli pressur physic chemistri refer phase transit gase liquid specif condit temperatur pressur;сжижен;процесс превращен газ тверд веществ жидк состоян пут охлажден приложен давлен физическ хим относ фазов переход газ жидкост определен услов температур давлен
liquid junction potenti;potenti differ aris interfac dissimilar electrolyt solut differ ion mobil;диффузион потенциа;разност потенциал возника границ раздел двух различн электролит изз различ подвижн ион
liquid mixtur;homogen heterogen combin liquid separ physic mean;жидк сме;однородн неоднородн комбинац двух жидкост раздел физическ метод
liquid phase;state matter character particl close freeli allow substanc flow shape contain maintain nearli constant volum fix condit;жидк фаз;состоян веществ частиц располож свободн перемеща позвол веществ теч принима форм сосуд сохран постоя обь
liquid structur;arrang dynam molecul liquid character shortrang order lack longrang period;структур жидкост;расположен динамик молекул жидкост характеризующ ближн порядк отсутств дальн порядк
liquid viscos;measur liquid resist flow determin intern friction molecul;вязкост жидкост;мер сопротивлен жидкост течен обусловлен внутрен трен молекул
liquidliquid mixtur;homogen heterogen combin immisc partial miscibl liquid form distinct phase differ polar densiti solubl mixtur studi physic chemistri thermodynam transport properti;жидкостножидкостн сме;гомоген гетероген комбинац двух несмешива частичн смешива жидкост образ отдельн фаз изз различ полярн плотност растворим
liquidvapour phase boundari;curv phase diagram repres equilibrium condit liquid vapour phase;границ раздел жидкостьпар;крив фазов диаграмм представля услов равновес жидкост паров фаз
liter;metric unit volum equal 1 cubic decimet dm³ 1000 cubic centimet cm³ 0001 cubic meter m³ commonli measur liquid substanc everyday scientif context;литр;метрическ единиц объем равн 1 кубическ дециметр дм³ 1000 кубическ сантиметр см³ 0001 кубическ метр м³ широк использ измерен жидкост веществ
lithium atom;smallest unit lithium chemic element atom number 3 consist nucleu 3 proton typic 34 neutron surround 3 electron;ат лит;наименьш единиц лит химическ элемент атомн номер 3 состоя ядр 3 протон 34 нейтрон окружен 3 электрон
lithiumion batteri;recharg batteri lithium ion neg electrod posit electrod discharg charg known high energi densiti low selfdischarg memori effect;литийион аккумулятор;перезаряжа аккумулятор ион лит перемеща отрицательн электрод положительн разрядк обратн зарядк отлича высок энергоемк мал саморазряд отсутств эффект памят
lmct;ligandtomet charg transfer electron transit electron densiti move ligand metal center observ uvvi spectroscopi;перенос заряд лигандметалл;электрон переход электрон плотност перемеща лиганд металлическ центр наблюда уфвидим спектроскоп
lnk vs 1 t;graphic represent chemic kinet determin activ energi reaction plot natur logarithm rate constant lnk reciproc absolut temperatur 1 t describ arrheniu equat;lnk 1 t;графическ представлен химическ кинетик определен энерг активац реакц натуральн логарифм констант скорост lnk откладыва прот обратн абсолютн температур 1 t согласн уравнен аррениус
lnk vs 1 t plot;graphic represent chemic kinet determin activ energi reaction plot natur logarithm rate constant lnk invers temperatur 1 t yield straight line slope proport activ energi accord arrheniu equat;график lnk 1 t;графическ представлен химическ кинетик определен энерг активац реакц натуральн логарифм констант скорост lnk откладыва прот обратн температур 1 t дав прям лин наклон пропорциональн энерг активац согласн уравнен аррениус
local contribut;portion properti effect attribut specif region compon system quantum chemistri materi scienc;локальн вклад;част свойств эффект приписыва определен област компонент систем используем квантов хим материаловеден
local magnet field;magnet field experienc nucleu electron molecul influenc nearbi atom extern field;локальн магнитн пол;магнитн пол испытыва ядр электрон молекул влия соседн атом внешн пол
lock key model;model enzymesubstr interact suggest enzym activ site precis complementari substrat shape like key fit lock ensur specif biochem reaction;модел ключзамок;модел взаимодейств фермент субстрат предполага активн центр фермент идеальн соответств форм субстрат ключ замк обеспечив специфичн биохимическ реакц
lockandkey;model describ enzymesubstr interact enzym activ site perfectli fit substrat like key lock ensur specif;модел ключзамок;модел описыва взаимодейств фермент субстрат активн центр фермент идеальн подход субстрат ключ замк обеспечив специфичн
london;london capit citi unit kingdom global hub financ cultur polit locat southeastern england;лондон;лондон столиц соединен королевств глобальн центр финанс культур политик расположен юговосток англ
london formula;approxim equat quantum chemistri describ dispers interact neutral molecul induc dipol moment;формул лондон;приближен уравнен квантов хим описыва дисперсион взаимодейств двум нейтральн молекул изз индуцирова дипольн момент
long period;time interv character extend durat context like oscil period geolog timescal econom cycl;длительн период;времен интерва характериз продолжительн используем контекст период колебан геологическ времен масштаб экономическ цикл
longitudin relax;process magnet vector return equilibrium valu longitudin z axi character time constant t1;продольн релаксац;процесс возвращен вектор намагничен равновесн значен вдол продольн z ос характеризуем времен t1
longitudin relax time;characterist time nuclear spin return equilibrium magnet magnet field direct perturb denot t1;врем продольн релаксац;характерн врем возвращен ядерн спин равновесн намагничен вдол направлен магнитн пол возмущен обознача t1
longrang order;regular repeat arrang atom molecul materi larg distanc characterist crystallin solid;дальн порядок;регулярн повторя расположен атом молекул материал больш расстоян характерн кристаллическ тверд тел
lorentzian absorpt line;spectral line shape describ lorentz distribut characterist homogen broaden atom molecular absorpt spectra;лоренцевск лин поглощен;форм спектральн лин описыва распределен лоренц характерн однородн уширен атомн молекулярн спектр поглощен
loss modulu;measur energi dissip heat cycl deform viscoelast materi dynam load repres viscou compon materi respons;модул потер;мер энерг рассеива вид тепл цикл деформац вязкоупруг материал динамическ нагружен представля вязк составля отклик материа
loss;decreas reduct particular quantiti qualiti attribut scientif context describ energi dissip materi degrad;потер;уменьшен снижен определен количеств качеств атрибут используем научн контекст описан рассеиван энерг деградац материа
low temperatur;temperatur significantli standard ambient condit near boil point liquid nitrogen 77 k quantum effect uniqu materi properti promin;низк температур;температур значительн стандартн услов близк точк кипен жидк азот 77 проявля квантов эффект уникальн свойств материал
lowboil azeotrop;mixtur liquid boil constant temperatur lower compon form vapor composit liquid;низкокипя азеотроп;сме двух жидкост кипя постоя температур температур кипен компонент образу пар состав жидкост
lower consolut temperatur;minimum temperatur partial miscibl liquid fulli miscibl form singl phase;нижн критическ температур смешиваем;минимальн температур две частичн смешива жидкост станов полност смешива образу фаз
lower critic solut temperatur;minimum temperatur mixtur liquid partial miscibl higher temperatur complet miscibl proport;нижн критическ температур растворим;минимальн температур сме двух жидкост частичн смешива высок температур станов полност смешива пропорц
lower entropi;state system character reduc disord higher organ number possibl microscop configur minim associ increas energi effici stabil thermodynam process;низк энтроп;состоян систем уменьшен беспорядк повышен упорядочен числ возможн микроскопическ конфигурац минимальн связа повышен энергоэффективн стабильн термодинамическ процесс
