en_term_processed;en_definition_processed;ru_term_processed;ru_definition_processed
180;straight angl equival half rotat 360 form straight line;180;развернут угол равн половин полн оборот 360  образ прям лин
90;right angl exactli onequart rotat 360 measur 90 degre;90;прям угол равн четверт полн оборот 360  составля 90 градус
priori probabl;probabl event deriv logic reason prior knowledg empir data;априорн вероятн;вероятн событ выведен логическ рассужден предварительн знан эмпирическ
a2 system;classif system molecular symmetri denot specif point group chemistri molecul twofold rotat axi symmetri element;систем a2;систем классификац молекулярн симметр обознача определен точечн групп хим молекул имеют двукратн о вращен отсутств элемент симметр
abbe refractomet equat;equat relat refract index substanc critic angl refract abbe refractomet measur refract indic accur;уравнен рефрактометр абб;уравнен связыва показател преломлен веществ критическ угл преломлен используем рефрактометр абб точн измерен показател преломлен
absolut entropi;entropi substanc given temperatur calcul rel perfect crystal absolut zero entropi zero provid refer thermodynam calcul;абсолютн энтроп;энтроп веществ зада температур рассчита относительн идеальн кристалл абсолютн нул энтроп равн нул использ эталон термодинамическ расчет
absolut temperatur scale;temperatur scale measur temperatur rel absolut zero theoret lowest possibl temperatur thermal motion ceas kelvin scale commonli absolut temperatur scale scientif context;абсолютн температурн шкал;температурн шкал измеря температур относительн абсолютн нул теоретическ минимальн температур прекраща теплов движен шкал кельвин распространен абсолютн шкал наук
absolut zero;lowest possibl temperatur theoret motion particl constitut heat minim defin 0 k kelvin scale equival 27315 ° c 45967 ° f;абсолютн нул;наименьш возможн температур теплов движен частиц минимальн равн 0 k шкал кельвин соответств 27315 ° c 45967 ° f
absorb;logarithm measur light absorb sampl specif wavelength defin log10 t t transmitt sampl commonli spectroscopi quantifi concentr solut solut beerlambert law;оптическ плотност;логарифмическ мер количеств свет поглоща образц определен длин волн определя a log10 t t пропускан образц широк использ спектроскоп количествен определен концентрац растворен веществ помощ закон бугераламбертабер
absorpt;process atom molecul ion enter bulk phase ga liquid solid taken volum distinct adsorpt occur surfac chemistri refer uptak substanc liquid solid;абсорбц;процесс атом молекул ион проника обь фаз газ жидкост тверд тел поглоща отлич адсорбц происходя поверхн хим означа поглощен веществ жидкост тверд тел
absorpt coeffici;measur light radiat absorb materi unit distanc typic express unit invers length eg cm⁻¹ quantifi attenu intens electromagnet wave pass medium;коэффициент поглощен;мер свет друг излучен поглоща материал единиц расстоян выража единиц обратн длин см⁻¹ количествен характериз ослаблен интенсивн электромагнитн волн прохожден сред
absorpt intens;measur light absorb substanc specif wavelength determin concentr spectroscopi;интенсивн поглощен;мер количеств свет поглоща веществ определен длин волн используем определен концентрац спектроскоп
absorpt spectra;graph show light absorb substanc differ wavelength identifi quantifi materi uniqu absorpt pattern;спектр поглощен;график показыва количеств свет поглоща веществ разн длин волн используем идентификац количествен анализ материал уникальн спектр поглощен
absorpt spectroscopi;techniqu measur absorpt electromagnet radiat substanc function wavelength identifi quantifi chemic speci;абсорбцион спектроскоп;метод измеря поглощен электромагнитн излучен веществ зависим длин волн используем идентификац количествен определен химическ соединен
absorpt spectrum;graph show light absorb substanc differ wavelength identifi studi electron molecular structur materi;спектр поглощен;график показыва количеств свет поглоща веществ разн длин волн используем изучен электрон молекулярн структур материал
abstract;process simplifi complex system focus main featur ignor relev detail model theoret framework;абстракц;процесс упрощен сложн сист пут концентрац основн характеристик игнорирован значим детал используем моделирован теоретическ подход
abundantspin speci;nuclear spin state higher popul nmr typic lowerenergi state magnet field lead net magnet;избыточн спинов вид;ядерн спинов состоян больш населен ямр состоян меньш энерг магнитн пол созда чист намагничен
acceler molecular dynam;comput method enhanc sampl molecular configur appli bia potenti acceler rare event enabl studi longtimescal process molecular simul;ускорен молекулярн динамик;вычислительн метод улучша выборк молекулярн конфигурац пут применен смеща потенциал ускорен редк событ позволя изуча долговремен процесс молекулярн моделирован
acceler;rate chang veloc object respect time vector quantiti magnitud direct;ускорен;скорост изменен скорост объект относительн времен векторн величин имеющ величин направлен
acceler free fall;acceler object free fall influenc graviti approxim 981 ms² near earth surfac;ускорен свободн паден;ускорен объект свободн паден действ сил тяжест примерн 981 мс² поверхн земл
accept;meet minimum requir standard satisfactori adequ qualiti;приемлем;соответств минимальн требован стандарт удовлетворительн достаточн качеств
accept wavefunct;wavefunct quantum mechan continu singlevalu squareintegr satisfi schrödinger equat;допустим волнов функц;волнов функц квантов механик явля непрерывн однозначн квадратичноинтегрируем удовлетворя уравнен шредингер
acceptor level;energi level semiconductor accept electron valenc band creat hole increas conduct;акцепторн уровен;энергетическ уровен полупроводник способн принима электрон валентн зон создав дырк увеличив проводим
accommod;process eye chang optic power maintain clear focu object distanc vari;аккомодац;процесс изменен оптическ сил глаз сохранен четк фокус объект изменен расстоян
acet acid;colorless organ acid formula ch3cooh main compon vinegar solvent chemic synthesi;уксусн кислот;бесцветн органическ кислот формул ch3cooh основн компонент уксус используем растворител химическ синтез
acetylen;colorless highli flammabl ga chemic formula c2h2 fuel chemic build block simplest alkyn burn hot flame make use weld cut metal;ацетил;бесцветн легковоспламеня газ химическ формул c2h2 используем топлив химическ строительн блок прост алкин гор горяч пламен дела полезн сварк резк металл
acidbas equilibria;dynam balanc acid base solut govern proton transfer reaction concentr reactant product remain constant time describ equilibrium constant like ka kb;кислотноосновн равновес;динамическ баланс кислот основан раствор определя реакц перенос протон концентрац реагент продукт оста постоя описыва констант равновес ka kb
acquisit convent;principl agreement physic chemistri system acquir properti compon surround specif condit;приобретательн конвенц;принцип соглашен физическ хим согласн систем приобрета свойств компонент окружа сред определен услов
actinoid actinid;seri 15 metal element actinium lawrencium period tabl character fill 5f electron shell;актиноид;сер 15 металлическ элемент актин лоуренс периодическ таблиц характеризующ заполнен 5фэлектрон оболочк
activ complex;transient highenergi intermedi state form chemic reaction repres highest potenti energi point reaction pathway;активирова комплекс;времен высокоэнергетическ промежуточн состоян образ ход химическ реакц представля точк максимальн потенциальн энерг пут реакц
activ complex theori;theori explain reaction rate consid intermedi transit state activ complex form convers reactant product;теор активирова комплекс;теор объясня скорост реакц промежуточн переходн состоян активирова комплекс образ превращен реагент продукт
activ energi;minimum energi requir chemic reaction occur repres ea arrheniu equat;энерг активац;минимальн энерг необходим протекан химическ реакц обознача ea уравнен аррениус
activ enthalpi;minimum enthalpi requir chemic reaction occur repres energi barrier reactant product;энтальп активац;минимальн энтальп необходим протекан химическ реакц представля энергетическ барьер реагент продукт
activ gibb energi;gibb free energi differ transit state reactant chemic reaction determin reaction rate;энерг гиббс активац;разност энерг гиббс переходн состоян реагент химическ реакц определя скорост реакц
activationcontrol limit;regim chemic kinet reaction rate determin activ energi barrier diffus transport process;активационноконтролируем предел;реж химическ кинетик скорост реакц определя энергетическ барьер активац диффуз транспортн процесс
activ site;specif region enzym substrat molecul bind undergo chemic reaction character uniqu threedimension structur chemic properti;активн центр;специфическ участок фермент молекул субстрат связыва подверга химическ реакц характериз уникальн трехмерн структур химическ свойств
activ site;specif region surfac catalyst reactant molecul adsorb undergo chemic reaction uniqu electron geometr properti;активн центр;специфичн участк поверхн катализатор молекул реагент адсорбир вступа химическ реакц уникальн электрон геометрическ свойств
activ;measur effect concentr speci solut account deviat ideal behavior interact particl;активн;мер эффективн концентрац частиц раствор учитыва отклонен идеальн поведен изз взаимодейств частиц
activ coeffici;factor account deviat ideal behavior solut quantifi effect concentr activ solut differ actual concentr interact speci;коэффициент активн;фактор учитыва отклонен идеальн поведен раствор показыва эффективн концентрац активн растворен веществ отлича реальн концентрац изз взаимодейств частиц
activ coeffici;dimensionless factor account deviat ideal behavior solut repres effect concentr solut quantifi interact molecul affect chemic potenti nonid system;коэффициент активн;безразмерн коэффициент учитыва отклонен идеальн поведен раствор представля эффективн концентрац растворен веществ описыва влиян межмолекулярн взаимодейств химическ потенциа неидеальн систем
addit;chemic reaction molecul combin form larger typic involv unsatur compound;присоединен;химическ реакц две молекул соединя образу крупн молекул участ ненасыщен соединен
addit polymer;polymer process unsatur monom link loss atom typic initi free radic ion catalyst form long polym chain byproduct;полимеризац механизм присоединен;процесс полимеризац ненасыщен мономер соединя потер атом инициируем свободн радикал ион катализатор образу длин полимерн цеп побочн продукт
addit work;extra work system revers work irrevers process like friction dissip;дополнительн работ;дополнительн работ соверша систем обратим работ обусловлен необратим процесс трен диссипац
adiabat approxim;simplif quantum mechan motion atom nuclei electron treat separ assum electron adjust instantan nuclear posit bornoppenheim approxim simplifi molecular system calcul;адиабатическ приближен;упрощен квантов механик движен ядер электрон рассматрива раздельн предполаг мгновен адаптац электрон положен ядер используем приближен борнаоппенгеймер
adiabat bomb calorimet;devic measur heat combust ignit sampl oxygenfil chamber surround water maintain adiabat condit prevent heat loss;адиабатическ бомбов калориметр;устройств измеря теплот сгоран пут воспламенен образц камер заполнен кислород окружен вод адиабатическ услов предотвращен потер тепл
adiabat boundari;boundari prevent heat transfer system surround maintain thermal isol;адиабатическ границ;границ предотвраща теплообм систем окружа сред обеспечив теплов изоляц
adiabat chang;process heat exchang surround typic occur rapidli thermal insul system;адиабатическ изменен;процесс происход обм тепл окружа сред происходя быстр термоизолирова систем
adiabat expans;thermodynam process ga expand heat transfer surround caus temperatur chang work ga;адиабатическ расширен;термодинамическ процесс газ расширя теплообм окружа сред привод изменен температур изз работ соверша газ
adiabat flame calorimet;devic measur heat combust burn sampl oxygenrich environ nearli adiabat condit prevent heat loss;адиабатическ калориметр пламен;прибор измерен теплот сгоран образец сжига кислородн сред практическ адиабатическ услов предотвраща потер тепл
adiabat process;thermodynam process heat transfer system result chang temperatur pressur sole work system;адиабатическ процесс;термодинамическ процесс происход теплообм окружа сред изменен температур давлен обусловл работ соверша систем
adsorb;substanc accumul surfac solid liquid adsorb form thin film process adsorpt involv intermolecular forc;адсорбат;веществ накаплива поверхн тверд тел жидкост адсорбент образу тонк пленк процесс адсорбц связа межмолекулярн сил
adsorpt;adhes atom ion molecul ga liquid dissolv solid surfac creat thin film;адсорбц;прилипан атом ион молекул газ жидкост растворен тверд веществ поверхн образован тонк сло
adsorpt constant;measur extent substanc adsorb surfac equilibrium defin ratio adsorb concentr concentr surround phase given temperatur;констант адсорбц;мер степен адсорбц веществ поверхн равновес определя отношен адсорбирова концентрац концентрац окружа фаз зада температур
adsorpt isotherm;graph show relationship adsorb surfac adsorb pressur concentr constant temperatur studi surfac properti interact;изотерм адсорбц;график показыва зависим количеств адсорбат поверхн адсорбент давлен концентрац постоя температур используем изучен поверхностн свойств взаимодейств
adsorptiondesorpt equilibrium;state rate adsorpt desorpt molecul surfac equal result dynam balanc molecul attach detach surfac equilibrium determin surfac concentr adsorb speci given condit;равновес адсорбциидесорбц;состоян скорост адсорбц десорбц молекул поверхн равн создав динамическ баланс присоединен отрыв молекул равновес определя поверхностн концентрац адсорбирова веществ услов
aedan;fluoresc dye molecular probe biochemistri biophys studi protein interact conform chang;аеданс;флуоресцентн красител используем качеств молекулярн зонд биохим биофизик изучен взаимодейств белк конформацион изменен
aerosol;suspens fine solid particl liquid droplet air ga;аэрозол;взве мелк тверд частиц капел жидкост воздух друг газ
ae;atom emiss spectroscopi techniqu analyz light emit excit atom determin element composit;аэс;атомноэмиссион спектроскоп метод анализ свет излуча возбужден атом определен элементн состав
afm;highresolut imag techniqu sharp probe scan surfac map topographi atom level mechan forc;атомносилов микроскоп;высокочувствительн метод микроскоп применя исследован поверхн атомарн разрешен помощ механическ зонд
aggreg equilibrium;dynam balanc system rate particl aggreg equal rate disaggreg maintain stabl distribut particl size;равновес агрегац;динамическ равновес систем скорост агрегац частиц равн скорост дезагрегац поддержива стабильн распределен размер частиц
alanin;nonessenti amino acid c3h7no2 involv protein synthesi glucos metabol commonli found protein;аланин;незаменим аминокислот c3h7no2 участвующ синтез белк метаболизм глюкоз встреча белк
albert einstein;theoret physicist develop theori rel pillar modern physic alongsid quantum mechan best known massenergi equival formula e mc² dub world famou equat;альберт эйнштейн;теоретическ физик разработа теор относительн осн современ физик извест формул эквивалентн масс энерг e mc²
alkalin batteri;type primari batteri deriv energi reaction zinc manganes dioxid alkalin electrolyt potassium hydroxid provid higher energi densiti longer shelf life compar zinccarbon batteri;щелочн батарейк;тип первичн источник ток энерг вырабатыва реакц цинк диоксид марганц щелочн электрол гидроксид кал облада больш энергоемк срок хранен сравнен солев батарейк
alloster regul;regul enzym protein bind effector molecul site activ site result conform chang alter activ;аллостерическ регуляц;регуляц активн фермент белк пут связыван эффекторн молекул активн центр вызыва конформацион изменен изменя активн
allotrop;differ structur form element physic state differ atom arrang molecular structur;аллотропн модификац;различн структурн форм элемент физическ состоян отлича атомн расположен молекулярн структур
allow transit;quantum transit state permit select rule typic involv chang dipol moment;разрешен переход;квантов переход состоян разрешен правил отбор связа изменен дипольн момент
alloy;metal substanc compos element compound solid solut properti superior pure metal wide engin industri;сплав;металлическ материа состоя двух элемент образ соединен тверд раствор улучшен свойств широк применя техник промышлен
amber;amber fossil tree resin appreci color beauti prehistor time jewelri ornament contain preserv prehistor insect plant materi;янтар;ископа смол дерев ценим цвет красот древн врем использ ювелирн издел содерж включен древн насеком растен
ammonia;colorless ga pungent smell compos nitrogen hydrogen nh wide fertil clean product industri applic key intermedi nitrogen cycl produc natur decompos organ matter;аммиак;бесцветн газ резк запах состоя азот водород nh широк используем удобрен чистя средств промышлен явля ключев промежуточн продукт круговорот азот образ разложен органик
substanc;physic quantiti measur number elementari entiti eg atom molecul sampl express mole;количеств веществ;физическ величин измеря количеств элементарн частиц атом молекул образц выража мол
amper;si base unit electr current defin constant current produc forc 2×10⁻⁷ newton meter parallel conductor infinit length neglig crosssect place meter apart vacuum;ампер;основн единиц сил электрическ ток си определя постоя ток созда сил 2×10⁻⁷ ньютон метр двум параллельн проводник бесконечн длин ничтожн мал сечен расположен расстоян метр вакуум
